<!-- 
  Licensed to the Apache Software Foundation (ASF) under one
  or more contributor license agreements.  See the NOTICE file
  distributed with this work for additional information
  regarding copyright ownership.  The ASF licenses this file
  to you under the Apache License, Version 2.0 (the
  "License"); you may not use this file except in compliance
  with the License.  You may obtain a copy of the License at

  http://www.apache.org/licenses/LICENSE-2.0

  Unless required by applicable law or agreed to in writing,
  software distributed under the License is distributed on an
  "AS IS" BASIS, WITHOUT WARRANTIES OR CONDITIONS OF ANY
  KIND, either express or implied.  See the License for the
  specific language governing permissions and limitations
  under the License.
-->

<!-- DTD for CAIRIS location models -->

<!ELEMENT locations (location*)>
<!ATTLIST locations name CDATA #REQUIRED>
<!ATTLIST locations diagram CDATA #REQUIRED>

<!ELEMENT location (asset_instance*,persona_instance*,link+)>
<!ATTLIST location name CDATA #REQUIRED>

<!ELEMENT asset_instance EMPTY>
<!ATTLIST asset_instance name CDATA #REQUIRED>
<!ATTLIST asset_instance asset CDATA #REQUIRED>

<!ELEMENT persona_instance EMPTY>
<!ATTLIST persona_instance name CDATA #REQUIRED>
<!ATTLIST persona_instance persona CDATA #REQUIRED>

<!ELEMENT link EMPTY>
<!ATTLIST link name CDATA #REQUIRED>
